"""%s"" is not available in the requested quantity. %s of the items will be backordered.","""%s"" no está disponible en la cantidad solicitada. Se ha cursado orden de pedido a proveedor para %s de los artículos."
"%s is available for purchase in increments of %s only.","%s sólo se puede comprar en incrementos de %s."
"%s is not a correct comparsion method.","%s no es un método de comparación correcto."
"<strong>Note</strong> that these settings are applicable to cart line items, not the whole cart.","<strong>Tenga en cuenta</strong> que esta configuración es aplicable a los artículos de línea de la cesta de compras, no a la cesta en su totalidad."
"Add Minimum Qty","Añadir cantidad mínima"
"Allow Qty Below 0","Permitir cantidad menor que 0"
"Allow Qty Below 0 and Notify Customer","Permitir cantidad menor que 0 y notificar al Cliente"
"Automatically Return Credit Memo Item to Stock","Devolver automáticamente a existencias el/los artículo/s de las facturas de abono"
"Backorders","Pedidos Pendientes"
"By Fixed value","Por valor Fijo"
"By Percentage","Por Porcentaje"
"Cannot specify product identifier for the order item.","No se puede especificar el identificador del producto para el artículo del pedido."
"Catalog Inventory","Inventario del Catálogo"
"Decrease Stock When Order is Placed","Disminuir Existencias Cuando Se Realiza El Pedido"
"Display Out of Stock Products","Visualizar los productos agotados"
"Display products availability in stock in the frontend","Mostrar la disponibilidad de productos en stock en la parte delantera"
"Enable Qty Increments","Posibilitar Incrementos de Cantidad"
"In Stock","Disponible"
"Index Product Stock Status","Índice de estado de existencias de producto"
"Inventory","Inventario"
"Inventory API","API del inventario"
"Inventory Section","Sección del inventario"
"Manage Stock","Gestionar existencias"
"Maximum Qty Allowed in Shopping Cart","Cantidad máxima permitida en la cesta de la compra"
"Minimum Qty","Cantidad Mínima"
"Minimum Qty Allowed in Shopping Cart","Cantidad mínima permitida en la cesta de la compra"
"Multi update product stock data","Actualización multiple de datos de stock de productos"
"No Backorders","No hay pedidos pendientes"
"Not all products are available in the requested quantity","No todos los productos están disponibles en la cantidad solicitada."
"Notify for Quantity Below","Notificar cuando la cantidad sea inferior a"
"Only X left Threshold","Sólo X ha superado el umbral"
"Out of Stock","No disponible"
"Product Stock Options","Opciones de existencias del producto"
"Products will still be shown by direct product URLs.","Los productos se seguirán mostrando por URL de producto directa"
"Qty Increments","Incrementos de cantidad"
"Qty for Item's Status to Become Out of Stock","Cantidad de artículos disponibles antes de agotarse"
"Retrieve stock data","Recuperar datos de existencias"
"Retrieve stock data by product ids","Recuperar datos de existencias por identificadores de producto"
"Rule price","Regla de precio"
"Set Items' Status to be In Stock When Order is Cancelled","Establecer Estado de Artículos en Existencias Cuando Se Cancela Un Pedido"
"Some of the products are currently out of stock.","Algunos de los productos están actualmente agotados."
"Some of the products cannot be ordered in requested quantity.","Algunos de los productos no se pueden encargar en la cantidad solicitada."
"Some of the products cannot be ordered in the requested quantity.","No se puede realizar el pedido de algunos productos en la cantidad solicitada."
"Stock Options","Opciones de existencias"
"Stock Status","Estado de existencias"
"The maximum quantity allowed for purchase is %s.","La cantidad máxima permitida para comprar es de %s."
"The minimum quantity allowed for purchase is %s.","La cantidad mínima permitida para comprar es de %s."
"The requested quantity for ""%s"" is not available.","La cantidad solicitada de ""%s"" no está disponible."
"The stock item for Product in option is not valid.","El artículo de existencias para el Producto en opción no es válido."
"The stock item for Product is not valid.","El artículo de existencias para el Producto no es válido."
"This product is available for purchase in increments of %s only.","Este producto esta disponible para la compra en incrementos de %s únicamente."
"This product is currently out of stock.","Este producto está agotado en este momento."
"This product is not available in the requested quantity. %s of the items will be backordered.","Este producto solo esta disponible bajo encargo, una vez curses el pedido nos pondremos en contacto contigo para concretar los detalles de la entrega."
"To Fixed Value","Para Valor Fijo"
"To Percentage","Para Porcentaje"
"Undefined product type.","Tipo de producto no definido."
"Update","Actualización"
"Update product stock data","Actualizar datos de existencias de producto"
"Update the Product","Actualizar el Producto"